{
  "id": "minnesota",
  "name": "Minnesota",
  "displayName": "Minnesota",
  "slug": "minnesota",
  "abbreviation": "MN",
  "tagline": "Premium Minnesota Truck Dispatch Services",
  "description": "Connect with high-paying freight loads across Minnesota and nationwide. Our expert dispatch team specializes in Minnesota's major freight corridors.",
  "longDescription": "Minnesota is a critical freight hub with diverse freight opportunities. Our dispatch services connect carriers with premium loads across Minnesota's extensive highway network.",
  "overview": "Minnesota offers diverse freight opportunities with strong demand for dry van, reefer, and flatbed services.",
  "marketOverview": "Minnesota's freight market is competitive with high demand for various freight types. Rates are typically competitive with national averages.",
  "averageRates": "Average rates range from $2.40-$3.00 per mile for dry van, $2.40-$3.00 for reefer, and $2.40-$3.00 for flatbed depending on route and season.",
  "marketTrends": [
    "Strong demand for regional and cross-country routes",
    "Seasonal peaks during harvest and holiday seasons",
    "E-commerce freight growing rapidly",
    "Infrastructure improvements driving efficiency"
  ],
  "keyIndustries": [
    "Manufacturing",
    "Agriculture",
    "Retail and Distribution",
    "Technology",
    "Automotive",
    "E-commerce"
  ],
  "majorCities": [
    "Major City 1",
    "Major City 2",
    "Major City 3"
  ],
  "commonFreightTypes": [
    "Consumer Goods",
    "Electronics",
    "Automotive Parts",
    "Food Products",
    "Building Materials",
    "E-commerce Packages"
  ],
  "benefits": [
    "Access to major freight corridors",
    "High freight volumes",
    "Diverse freight types",
    "Strong infrastructure",
    "Competitive rates"
  ],
  "challenges": [
    "Weather considerations",
    "Traffic congestion in metro areas",
    "Regulatory compliance",
    "Fuel costs",
    "Seasonal variations"
  ],
  "regulations": [
    "Federal hours of service regulations",
    "Weight restrictions on certain routes",
    "State-specific requirements",
    "Environmental standards"
  ],
  "seasonalConsiderations": [
    "Peak shipping season: Fall and Winter",
    "Holiday shipping surge: November-December",
    "Weather impacts during winter months",
    "Agricultural season variations"
  ],
  "seasonalTrends": {
    "q1": {
      "rateMovement": "Rates typically decrease 5-10% in Minnesota as market recovers from holiday season",
      "weatherImpact": "Winter weather can create rate spikes during storms",
      "strategy": "Position near distribution hubs early in the week for best rates"
    },
    "q2": {
      "rateMovement": "Strong rate increases as freight volume picks up",
      "weatherImpact": "Spring weather generally favorable, minimal disruptions",
      "strategy": "Focus on agricultural and retail freight during peak season"
    },
    "q3": {
      "rateMovement": "Peak rates during summer months",
      "weatherImpact": "Heat can impact certain freight types",
      "strategy": "Maximize outbound loads, plan for backhaul opportunities"
    },
    "q4": {
      "rateMovement": "Highest rates during holiday shipping season",
      "weatherImpact": "Winter weather begins to impact northern routes",
      "strategy": "Book early, rates peak in November-December"
    }
  },
  "intermodalCenters": [
    {
      "name": "Major City 1 Intermodal Terminal",
      "description": "Major rail-to-truck transfer facility"
    }
  ],
  "truckStops": [
    {
      "name": "Pilot Travel Center - Major City 1",
      "location": "I-35, Exit 420",
      "description": "Full-service facility with 200+ parking spaces"
    },
    {
      "name": "Love's Travel Stop - Major City 2",
      "location": "I-20, Exit 150",
      "description": "24/7 fuel and amenities"
    }
  ],
  "parkingDifficulty": "Moderate - Metro areas have high demand, especially evenings",
  "strategicPositioning": [
    "Position near major distribution centers in Major City 1 for quick access to outbound loads",
    "Stay near high-traffic freight corridors for backhaul opportunities",
    "Arrive at destination areas during peak booking times (typically early morning) for best rate opportunities"
  ],
  "weightLimits": {
    "singleAxle": "20,000 lbs",
    "tandemAxle": "34,000 lbs",
    "grossVehicleWeight": "80,000 lbs (standard)"
  },
  "sizeLimits": {
    "width": "8.5 feet (102 inches)",
    "height": "13.5 feet (varies by route)",
    "length": "53 feet (trailer)"
  },
  "permits": [
    {
      "type": "Oversized/Overweight",
      "description": "Required for loads exceeding standard weight or size limits"
    },
    {
      "type": "Hazardous Materials",
      "description": "Required for hazmat freight"
    },
    {
      "type": "Special Route Requirements",
      "description": "May be needed for certain routes"
    }
  ],
  "rateTrends": {
    "historicalRates": [
      {
        "period": "2018-2019",
        "description": "Strong market with rates reaching peak levels due to capacity constraints"
      },
      {
        "period": "2020",
        "description": "Initial volatility followed by strong recovery"
      },
      {
        "period": "2021-2022",
        "description": "Record-high rates driven by demand surge"
      },
      {
        "period": "2023-2024",
        "description": "Normalization with seasonal variations"
      }
    ],
    "marketCorrections": [
      {
        "period": "Q1 2023",
        "description": "Significant correction as capacity increased"
      },
      {
        "period": "Mid-2024",
        "description": "Stabilization with improved balance"
      }
    ],
    "projection2025": "Based on current market indicators, Minnesota is expected to see moderate growth with steady rate increases as market continues to stabilize",
    "rateDrivers": [
      "Freight volume and demand",
      "Available truck capacity",
      "Fuel costs and operating expenses",
      "Major industry activity (Manufacturing)"
    ]
  },
  "deadheadStrategy": {
    "outboundPercentage": "65%",
    "inboundPercentage": "35%",
    "bestBackhaulLanes": [
      {
        "name": "Minneapolis to Chicago",
        "description": "Strong return lane with consistent freight",
        "rate": "$2.40 - $3.00"
      },
      {
        "name": "Minneapolis to Dallas",
        "description": "Strong return lane with consistent freight",
        "rate": "$2.40 - $3.00"
      },
      {
        "name": "Minneapolis to Atlanta",
        "description": "Strong return lane with consistent freight",
        "rate": "$2.40 - $3.00"
      }
    ],
    "positioningStrategies": [
      "Position near distribution hubs in Major City 1 for quick access to outbound loads",
      "Arrive at destination areas during peak booking times (typically early morning) to secure better rates and backhaul options",
      "Leverage high-volume freight corridors to catch both outbound and inbound opportunities",
      "Use load boards before arriving at destination to pre-book backhaul loads and minimize wait time"
    ]
  },
  "dispatcherInsights": [
    "In Minnesota, timing is everything. Book outbound loads early in the week when rates are typically 10-15% higher.",
    "The Major City 1 area sees the highest load volume, but don't ignore secondary markets - they often offer better rates with less competition.",
    "Weather patterns in Minnesota can create sudden rate spikes. Monitor forecasts and position yourself ahead of storms for premium rates.",
    "Backhaul opportunities are strongest on routes connecting Minnesota to neighboring states. Plan your positioning accordingly.",
    "Many brokers in Minnesota prefer working with dispatchers who understand local regulations. Build relationships with regional brokers.",
    "Peak booking times in Minnesota are typically 6-9 AM. Have your truck positioned and ready to accept loads during these hours.",
    "The Manufacturing sector drives significant freight volume. Understanding their shipping patterns gives you a competitive edge.",
    "Don't overlook smaller lanes within Minnesota. While major routes get attention, secondary routes often have less competition and better rates."
  ],
  "faq": [
    {
      "question": "Do I need state authority to operate in Minnesota?",
      "answer": "Yes, you need proper authority to operate in Minnesota. This typically includes USDOT number, MC number, and state-specific permits. Some states require additional registrations. Consult with a compliance expert to ensure you have all necessary authority before operating in Minnesota."
    },
    {
      "question": "What insurance is required for trucking in Minnesota?",
      "answer": "Minimum insurance requirements include primary liability coverage (typically $750,000-$1,000,000), cargo insurance, and physical damage coverage. Minnesota may have additional requirements depending on the type of freight you're hauling. Always verify current insurance requirements with your insurance provider and state authorities."
    },
    {
      "question": "What pays best in Minnesota?",
      "answer": "Premium rates in Minnesota typically come from specialized freight including refrigerated loads, flatbed freight, and time-sensitive deliveries. The Manufacturing sector often offers competitive rates. Outbound loads from major distribution hubs also command premium rates."
    },
    {
      "question": "Is Minnesota good for new owner operators?",
      "answer": "Minnesota offers opportunities for new owner operators, especially with strong freight volume and diverse industries. However, competition can be high in major metro areas. New operators should focus on building relationships with reliable brokers, understanding local regulations, and starting with established lanes before expanding."
    },
    {
      "question": "What are the best lanes from Minnesota?",